{
  "schemaVersion": 1,
  "id": "share-card",
  "version": "1.0.0",
  "title": "Share Card",
  "summary": "A local result card and native share action with no analytics or backend.",
  "category": "sharing",
  "maturity": "experimental",
  "platforms": ["ios"],
  "requires": ["rank-progression"],
  "conflicts": [],
  "contributions": {
    "overlay": "overlay",
    "manifestFragments": [],
    "entitlements": [],
    "privacy": [
      "Sharing occurs only after the person invokes the native share sheet."
    ],
    "xcodeSourcePaths": [
      "App/Skills/ShareCard"
    ]
  },
  "acceptanceChecks": [
    {
      "id": "share-card-source-present",
      "type": "file",
      "path": "App/Skills/ShareCard/ShareCardView.swift"
    }
  ],
  "agentInstructions": [
    "Keep sharing owner-initiated through the native share sheet.",
    "Do not add upload, analytics, or tracking to the share path."
  ]
}
