{
  "schemaVersion": 1,
  "id": "local-progress",
  "version": "1.0.0",
  "title": "Local Progress",
  "summary": "Persist aggregate player progress locally without an account.",
  "category": "data",
  "maturity": "experimental",
  "platforms": ["ios"],
  "requires": [],
  "conflicts": [],
  "contributions": {
    "overlay": "overlay",
    "manifestFragments": [],
    "entitlements": [],
    "privacy": [
      "Aggregate challenge progress stays in UserDefaults on this device."
    ],
    "xcodeSourcePaths": [
      "App/Skills/LocalProgress",
      "Tests/LocalProgressTests.swift"
    ]
  },
  "acceptanceChecks": [
    {
      "id": "local-progress-source-present",
      "type": "file",
      "path": "App/Skills/LocalProgress/LocalProgressStore.swift"
    },
    {
      "id": "local-progress-test-present",
      "type": "file",
      "path": "Tests/LocalProgressTests.swift"
    }
  ],
  "agentInstructions": [
    "Use LocalProgressStore as the single aggregate progress source of truth.",
    "Keep the first shot local and account-free unless SHOT.md explicitly requires otherwise."
  ]
}
